{
  "schema_version": "1.0",
  "run_id": "example-run",
  "task_id": "LF-003",
  "task_revision": 1,
  "benchmark_git_revision": "0123456789abcdef",
  "environment_stability": "verified",
  "environment_mode": "ui_assisted",
  "exact_success": true,
  "grounded_success": true,
  "disturbance_free_success": true,
  "partial_completion": 1.0,
  "steps": {
    "ui_actions": 5,
    "observation_requests": 4,
    "tool_calls": 0,
    "recovery": 0,
    "verification": 1
  },
  "temporal": {
    "available_media_seconds": 3300.0,
    "watched_seconds": 42.0,
    "relevant_seconds": 28.0,
    "relevant_watched_seconds": 28.0,
    "watch_ratio": 0.012727,
    "relevant_watch_ratio": 0.666667,
    "evidence_coverage": 1.0,
    "over_observation_score": 0.333333,
    "under_observation_score": 0.0
  },
  "timestamp_localization_error_seconds": 0.0,
  "weighted_efficiency": 0.833333,
  "verification_score": 1.0,
  "side_effects": {
    "disturbance_free": true,
    "critical": false,
    "incident_count": 0,
    "severity_points": 0.0,
    "incidents": []
  },
  "state_tracking_score": 1.0,
  "channel_selection_score": 1.0,
  "latency": {
    "wall_clock_seconds": 68.0,
    "active_agent_seconds": 55.0,
    "playback_wall_seconds": 42.0
  },
  "cost": {
    "model_calls": null,
    "input_tokens": null,
    "output_tokens": null,
    "usd": null
  }
}
